{
  "chief_complaint": "Productive cough with yellow sputum for 5 days",
  "vitals": {
    "bp": "122/78",
    "hr": 74,
    "temp_f": 98.2,
    "spo2": 99
  },
  "medications": [
    {
      "name": "Azithromycin",
      "dose": "500 mg",
      "frequency": "once daily",
      "route": "oral"
    },
    {
      "name": "Omeprazole",
      "dose": "20 mg",
      "frequency": "once daily",
      "route": "oral"
    }
  ],
  "diagnoses": [
    {
      "description": "Major depressive disorder",
      "icd10": "F32.9"
    }
  ],
  "plan": [
    "Increase fluid intake to at least 2 liters per day",
    "Pulmonary function tests ordered",
    "Apply ice pack to affected area 20 minutes three times daily",
    "Avoid NSAIDs due to renal function",
    "Elevate affected limb when resting"
  ],
  "follow_up": {
    "interval_days": 10,
    "reason": "Thyroid level recheck"
  }
}