{
  "chief_complaint": "Unintentional weight loss of 10 lbs over 1 month",
  "vitals": {
    "bp": "146/92",
    "hr": 94,
    "temp_f": 100.4,
    "spo2": 96
  },
  "medications": [
    {
      "name": "Hydrochlorothiazide",
      "dose": "25 mg",
      "frequency": "once daily",
      "route": "oral"
    }
  ],
  "diagnoses": [
    {
      "description": "Type 2 diabetes mellitus",
      "icd10": "E11.9"
    }
  ],
  "plan": [
    "Thyroid function tests ordered",
    "Topical steroid cream applied to affected area twice daily",
    "Rest and avoid strenuous activity for 1 week",
    "Increase fluid intake to at least 2 liters per day",
    "Sleep hygiene counseling provided",
    "Low-sodium diet; limit to less than 2 g sodium per day"
  ],
  "follow_up": {
    "interval_days": 14,
    "reason": "Blood pressure recheck"
  }
}