{
  "chief_complaint": "Right knee pain and swelling after a fall",
  "vitals": {
    "bp": "156/94",
    "hr": 104,
    "temp_f": 101.4,
    "spo2": 95
  },
  "medications": [
    {
      "name": "Losartan",
      "dose": "50 mg",
      "frequency": "once daily",
      "route": "oral"
    },
    {
      "name": "Metoprolol",
      "dose": "25 mg",
      "frequency": "twice daily",
      "route": "oral"
    },
    {
      "name": "Lisinopril",
      "dose": "10 mg",
      "frequency": "once daily",
      "route": "oral"
    }
  ],
  "diagnoses": [
    {
      "description": "Acute pharyngitis",
      "icd10": "J02.9"
    },
    {
      "description": "Low back pain",
      "icd10": "M54.5"
    },
    {
      "description": "Acute bronchitis",
      "icd10": "J20.9"
    }
  ],
  "plan": [
    "Low-sodium diet; limit to less than 2 g sodium per day",
    "Return to ER if symptoms worsen",
    "Glucose monitoring twice daily",
    "Weight loss goal: 5 lbs per month",
    "Dietary counseling referral placed",
    "Pulmonary function tests ordered"
  ],
  "follow_up": {
    "interval_days": 21,
    "reason": "Blood pressure recheck"
  }
}