{
  "chief_complaint": "Severe throbbing headache, 8/10 pain, started yesterday",
  "vitals": {
    "bp": "128/82",
    "hr": 78,
    "temp_f": 98.6,
    "spo2": 98
  },
  "medications": [
    {
      "name": "Furosemide",
      "dose": "40 mg",
      "frequency": "once daily",
      "route": "oral"
    }
  ],
  "diagnoses": [
    {
      "description": "Cellulitis",
      "icd10": "L03.90"
    }
  ],
  "plan": [
    "Complete full course of antibiotics",
    "Pulmonary function tests ordered",
    "Low-sodium diet; limit to less than 2 g sodium per day",
    "Elevate affected limb when resting",
    "Glucose monitoring twice daily"
  ],
  "follow_up": {
    "interval_days": 14,
    "reason": "Medication side effect monitoring"
  }
}